<?xml version="1.0" encoding="UTF-8"?>

<biblioteca xmlns:xsi="http://www.w3.org/2001/XMLSchema-instance" xsi:noNamespaceSchemaLocation="biblioteca.xsd">
        <libro id="L0000" tipo_clase="novela" pags="12">
            <titulo></titulo>
            <capitulos>
                <capitulo pags="20">
                    <titulo></titulo>
                    <contenido info="enlace"></contenido>
                </capitulo>
            </capitulos>
            <indice></indice>
            <sinopsis></sinopsis>
        </libro>
  
    <revista id="R0000" tipo_clase="informÃ¡tica" pags="45">
        <titulo></titulo>
        <numero>10</numero>
        <indice></indice>
        <secciones pags="30">
            <contenido info="enlace"></contenido>
        </secciones>
    </revista>

    <periodico id="P0000" tipo_clase="nacional" fecha_publicacion="fecha">
        <indice></indice>
        <seccion tipo_seccion="economica">
            <articulo autor="nombre">
                <contenido info="enlace"></contenido>
            </articulo>
        </seccion>
    </periodico>
</biblioteca>
